title,description,videoId,viewCount,likeCount,dislikeCount,commentCount,channelTitle,CviewCount,CcommentCount,subscriberCount
The danger of a single story | Chimamanda Ngozi Adichie,"http://www.ted.com Our lives, our cultures, are composed of many overlapping stories. Novelist Chimamanda Adichie tells the story of how she found her ...",D9Ihs241zeg,2886777,33279,472,1996,TED,851185597,4912,7644077
Debunking the paleo diet | Christina Warinner | TEDxOU,"TED Fellow Christina Warinner is an expert on ancient diets. So how much of the diet phad the ""Paleo Diet"" is based on an actual Paleolithic diet? The answer is ...",BMOjVYgYaG8,1557123,16074,2432,10653,TEDx Talks,1647594251,322,8471299
Why we do what we do | Tony Robbins,"Tony Robbins discusses the ""invisible forces"" that make us do what we do -- and high-fives Al Gore in the front row. TEDTalks is a daily video podcast of the best ...",Cpc-t-Uwv1I,11007442,56593,2818,6372,TED,851185597,4912,7644077
Ted 2 - Trailer Oficial Subtitulado [HD],Trailer oficial de Ted 2. Agosto 2015 en cines. Siguenos en Facebook en [https://www.facebook.com/yosoyTED] Siguenos en Twitter en @TedDice ...,UqbcKVIxOHM,6818980,13702,849,460,universalpicturesmx,446790885,496,620047
Feats of memory anyone can do | Joshua Foer,"http://www.ted.com There are people who can quickly memorize lists of thousands of numbers, the order of all the cards in a deck (or ten!), and much more.",U6PoUg7jXsA,882039,12738,195,706,TED,851185597,4912,7644077
Ted Plays Call of Duty!,As Ted gears up for the release of Ted 2 he gets really high on 4/20 and decides to play Black Ops 2 for the first time in a while on Johnny's Playstation. Watch as ...,xi_fxSTDj2o,12698740,171053,4437,7602,Azerrz,122573376,16,1552643
How the oceans can clean themselves: Boyan Slat at TEDxDelft,"18-year-old Boyan Slat combines environmentalism, entrepreneurism and technology to tackle global issues of sustainability. After diving in Greece, and coming ...",ROW9F-c0kIQ,2659662,21300,233,1653,TEDx Talks,1647594251,322,8471299
TED Talks Education,Found on: http://video.pbs.org/video/2365006219/ Hear inspiring leaders on the topic of learning in this TED project hosted by John Legend. Hear inspiring and ...,dilnw_dP3xk,473370,2206,94,121,Jathavan Sriram,515842,0,1714
Teach every child about food | Jamie Oliver,"http://www.ted.com Sharing powerful stories from his anti-obesity project in Huntington, W. Va., TED Prize winner Jamie Oliver makes the case for an all-out ...",go_QOzc79Uc,1057918,10993,1104,1169,TED,851185597,4912,7644077
Reggie Watts disorients you in the most entertaining way,http://www.ted.com Reggie Watts' beats defy boxes. Unplug your logic board and watch as he blends poetry and crosses musical genres in this larger-than-life ...,BdHK_r9RXTc,6652854,80711,2152,8367,TED,851185597,4912,7644077
Why don't perpetual motion machines ever work? - Netta Schramm,View full lesson: http://ed.ted.com/lessons/why-don-t-perpetual-motion-machines-ever-work-netta-schramm Perpetual motion machines -- devices that can do ...,A-QgGXbDyR0,1875307,44353,827,3239,TED-Ed,691645424,227,4933235
Keep your goals to yourself | Derek Sivers,"http://www.ted.com After hitting on a brilliant new life plan, our first instinct is to tell someone -- but Derek Sivers says it's better to keep goals secret. He presents ...",NHopJHSlVo4,780871,7379,147,528,TED,851185597,4912,7644077
The Space Between Self-Esteem and Self Compassion: Kristin Neff at TEDxCentennialParkWomen,"In the spirit of ideas worth spreading, TEDx is a program of local, self-organized events that bring people together to share a TED-like experience. At a TEDx ...",IvtZBUSplr4,830785,6878,198,428,TEDx Talks,1647594251,322,8471298
More than funny | Michael Jr. | TEDxUniversityofNevada,"With comedy, you not only laugh but you also gain understanding in a unique way. Comedy has a setup and then a punch line. The setup moves the audience in ...",twSvd5bQLDw,304212,6300,155,255,TEDx Talks,1647594251,322,8471298
Start with why -- how great leaders inspire action | Simon Sinek | TEDxPugetSound,Never miss a talk! SUBSCRIBE to the TEDx channel: http://bit.ly/1FAg8hB TEDx Puget Sound speaker - Simon Sinek - Start with Why: How Great Leaders Inspire ...,u4ZoJKF_VuA,3348288,25430,484,573,TEDx Talks,1647594251,322,8471299
Steve Austin responds to Ted DeBiase burying him,DAWN OF THE ATTITUDE ERA (BLU-RAY): ...,LwR8_Vichkc,16981,174,2,72,Wrestling Shoot Vault,5668611,0,8237
How CRISPR lets us edit our DNA | Jennifer Doudna,"Geneticist Jennifer Doudna co-invented a groundbreaking new technology for editing genes, called CRISPR-Cas9. The tool allows scientists to make precise ...",TdBAHexVYzc,404881,5815,136,657,TED,851185597,4912,7644077
What game theory teaches us about war | Simon Sinek,"What would happen if 'win' and 'lose' are no longer the only options when fighting a war? What if a third, more abstract ideal becomes the goal? And -- what if ...",0bFs6ZiynSU,169693,5033,285,288,TED Archive,6512634,0,40129
How playing an instrument benefits your brain - Anita Collins,"View full lesson: http://ed.ted.com/lessons/how-playing-an-instrument-benefits-your-brain-anita-collins When you listen to music, multiple areas of your brain ...",R0JKCYZ8hng,5710395,50639,487,2262,TED-Ed,691645424,227,4933235
Ted - Restricted Trailer,"http://tedisreal.com Family Guy creator Seth MacFarlane brings his boundary-pushing brand of humor to the big screen for the first time as writer, director and ...",aGW5gpMU9yo,6978010,41802,1336,6275,Ted,40620427,103,23887
Dr Joe Dispenza- TED Talks with Dr Joe Dispenza,"http://tinyurl.com/DrJoeDispenza Dr Joe Dispenza, D.C., studied biochemistry at Rutgers University in New Brunswick, N.J. He has a Bachelor of Science degree ...",W81CHn4l4AM,457653,3809,91,164,Lee Wiggins,457157,0,2137
What happens when you have a concussion? - Clifford Robbins,"View full lesson: https://ed.ted.com/lessons/what-happens-when-you-have-a-concussion-clifford-robbins Each year in the United States, players of sports and ...",xvjK-4NXRsM,356967,10509,112,613,TED-Ed,691645424,227,4933235
How to green the world's deserts and reverse climate change | Allan Savory,"""Desertification is a fancy word for land that is turning to desert,"" begins Allan Savory in this quietly powerful talk. And terrifyingly, it's happening to about ...",vpTHi7O66pI,1695041,35249,1182,5804,TED,851185597,4912,7644078
The Art of Stress-Free Productivity: David Allen at TEDxClaremontColleges,"Productivity guru and coach David Allen talks about ""Stress Free Productivity"" at TEDxClaremontColleges. About TEDx: In the spirit of ideas worth spreading, ...",CHxhjDPKfbY,1220724,11602,406,429,TEDx Talks,1647594251,322,8471299
How to build your creative confidence | David Kelley,"http://www.ted.com Is your school or workplace divided into ""creatives"" versus practical people? Yet surely, David Kelley suggests, creativity is not the domain of ...",16p9YRF0l-g,1345662,13683,271,561,TED,851185597,4912,7644078
How Do YOU Define Yourself    Lizzie Velasquez at TEDxAustinWomen,"n a time when beauty is defined by supermodels, success is defined by wealth, and fame is deified by how many followers you have on social media, Lizzie ...",c62Aqdlzvqk,11096558,120768,1204,13373,Lizzie Velasquez,60022387,3393,762378
[(TEDChu Pin )] Tian Ti Fei Zhu Liu Kai Xin You 308 Liang Ai Liao !Fov VS Infi!,"Mo Shou Zheng Ba TED Guan Fang Pin Dao V3 Da Jia Hao ,Wo Shi TED! Yi Hou De Suo You Shi Pin Du Hui Zai Zhe Ge V3Zhu Pin Dao Yi Yi Shang Chuan ,Tong Bu Geng Xin ! V3 (Zhu Pin Dao ) https://www.youtube.com/channel/UCQ...",-L-mKYp83dk,843,4,4,0,Mo Shou Zheng Ba TED Guan Fang Pin Dao  V3,582508,0,1664
Embrace the Shake | Phil Hansen | TED Talks,"In art school, Phil Hansen developed an unruly tremor in his hand that kept him from creating the pointillist drawings he loved. Hansen was devastated, floating ...",YrZTho_o_is,276580,4378,43,161,TED,851185597,4912,7644078
The Math Behind Basketball's Wildest Moves | Rajiv Maheswaran | TED Talks,"Basketball is a fast-moving game of improvisation, contact and, ahem, spatio-temporal pattern recognition. Rajiv Maheswaran and his colleagues are analyzing ...",66ko_cWSHBU,445717,3647,185,249,TED,851185597,4912,7644078
Minding your mitochondria | Dr. Terry Wahls | TEDxIowaCity,"Note from TED: This talk, which features health advice based on a personal narrative, has been flagged as potentially outside TED's curatorial guidelines.",KLjgBLwH3Wc,2783018,22010,588,2519,TEDx Talks,1647594251,322,8471299
Sam Hyde's 2070 Paradigm Shift,"Writing by Sam, Jan Rankoski, youtube.com/user/MrNapoleanMortimer, Andrew Ruse (Thanks, Computer!), and a bunch of other MDE fans PowerPoint ...",-yFhR1fKWG0,1454317,22873,835,3060,MillionDollarExtreme,25443289,235,117815
A Visual History of Human Knowledge | Manuel Lima | TED Talks,How does knowledge grow? Sometimes it begins with one insight and grows into many branches. Infographics expert Manuel Lima explores the thousand-year ...,BQZKs75RMqM,135693,1977,119,171,TED,851185597,4912,7644078
Richard Ledgett: The NSA responds to Edward Snowden's TED Talk,"After a surprise appearance by Edward Snowden at TED2014, Chris Anderson said: ""If the NSA wants to respond, please do."" And yes, they did. Appearing by ...",zLNXIXingyU,212857,1103,2906,1572,TED,851185597,4912,7644078
TED 2 Trailer German Deutsch (2015) Mark Wahlberg,"Offizieller ""Ted 2"" Trailer Deutsch German 2015 | Abonnieren  http://abo.yt/kc | (OT: Ted 2) Movie #Trailer | Kinostart: 25 Jul 2015 | Filminfos ...",l2SFgTVLBVA,4042232,21885,811,1185,KinoCheck,1145422211,51,1331584
Shia LaBeouf TED Talk,Shia gives a TED Talk on Motivation! Subscribe! Follow me @MichaelMcNeff on twitter. Thanks to #INTRODUCTIONS https://vimeo.com/125095515.,os6U77Hhm_s,3564498,22576,1902,2234,Michael McNeff,3570268,0,1206
Innovating to zero! | Bill Gates,"http://www.ted.com At TED2010, Bill Gates unveils his vision for the world's energy future, describing the need for ""miracles"" to avoid planetary catastrophe and ...",JaF-fq2Zn7I,1700218,11059,1269,4899,TED,851185597,4912,7644079
Why we should give everyone a basic income | Rutger Bregman | TEDxMaastricht,"This talk was given at a local TEDx event, produced independently of the TED Conferences. Rutger Bregman (1988) studied at Utrecht University and the ...",aIL_Y9g7Tg0,348131,5074,385,2116,TEDx Talks,1647594251,322,8471299
Buffy 2x11 - Ted Gets Mad At Buffy Playing Mini-Golf,"A scene from Buffy Season 2 Episode 11 (Ted) I DO NOT OWN THIS CREDIT GOES TOO... I do not own the copyrights contained in this video, I do not make ...",cZtmfWOsv_g,643,2,0,0,Laho Bo,46556661,632,22694
Building a psychologically safe workplace: Amy Edmondson at TEDxHGSE,"The Novartis Professor of Leadership and Management at Harvard Business School is well known for her work on teams. In the spirit of ideas worth spreading, ...",LhoLuui9gX8,147819,612,6,12,TEDx Talks,1647594251,322,8471299
How childhood trauma affects health across a lifetime | Nadine Burke Harris,"Childhood trauma isn't something you just get over as you grow up. Pediatrician Nadine Burke Harris explains that the repeated stress of abuse, neglect and ...",95ovIJ3dsNk,602075,10064,108,984,TED,851185597,4912,7644079
Why do we cry? The three types of tears - Alex Gendler,"View full lesson: http://ed.ted.com/lessons/why-do-we-cry-the-three-types-of-tears-alex-gendler Whether we cry during a sad movie, while chopping onions, ...",keMF8YzQoRM,3894812,27872,1404,2980,TED-Ed,691645424,227,4933236
How We Can Make the World a Better Place by 2030 | Michael Green | TED Talks,"Can we end hunger and poverty, halt climate change and achieve gender equality in the next 15 years? The governments of the world think we can. Meeting at ...",o08ykAqLOxk,187372,2862,211,457,TED,851185597,4912,7644079
Why Some of us Don't Have One True Calling | Emilie Wapnick | TEDxBend,"Have too many passions to settle on just one? Perfect. Your unique mix of interests may turn out to be your very own super power. Author, entrepreneur and ...",QJORi5VO1F8,286705,6049,57,386,TEDx Talks,1647594251,322,8471299
The Best of Ted Cruz,Take a look back at Ted Cruz's most memorable moments from his journey to the White House with this campaign supercut. Video by Vic Berger. Got an idea for ...,NcEiDY5qBbg,1301487,19064,1096,3536,Super Deluxe,178487337,0,875622
Science can answer moral questions | Sam Harris,"http://www.ted.com Questions of good and evil, right and wrong are commonly thought unanswerable by science. But Sam Harris argues that science can -- and ...",Hj9oB4zpHww,1273039,21477,1061,7582,TED,851185597,4912,7644079
The first 21 days of a bee's life | Anand Varma,We've heard that bees are disappearing. But what is making bee colonies so vulnerable? Photographer Anand Varma raised bees in his backyard -- in front of ...,6-tqiaPoS2U,664842,3399,123,220,TED,851185597,4912,7644079
How sugar affects the brain - Nicole Avena,"View full lesson: http://ed.ted.com/lessons/how-sugar-affects-the-brain-nicole-avena When you eat something loaded with sugar, your taste buds, your gut and ...",lEXBxijQREo,5603132,46735,1168,2146,TED-Ed,691645424,227,4933236
Daphne Koller: What we're learning from online education,"Daphne Koller is enticing top universities to put their most intriguing courses online for free -- not just as a service, but as a way to research how people learn.",U6FvJ6jMGHU,421510,6014,117,543,TED,851185597,4912,7644079
Want to be happy? Be grateful | David Steindl-Rast,"The one thing all humans have in common is that each of us wants to be happy, says Brother David Steindl-Rast, a monk and interfaith scholar. And happiness ...",UtBsl3j0YRQ,1553542,12260,1349,906,TED,851185597,4912,7644079
The paradox of choice | Barry Schwartz,"http://www.ted.com Psychologist Barry Schwartz takes aim at a central tenet of western societies: freedom of choice. In Schwartz's estimation, choice has made ...",VO6XEQIsCoM,2192796,19787,940,2747,TED,851185597,4912,7644079
The mystery box | JJ Abrams,"http://www.ted.com J.J. Abrams traces his love for the unseen mystery - a passion thats evident in his films and TV shows, including Cloverfield, Lost and Alias ...",vpjVgF5JDq8,645918,8980,219,816,TED,851185597,4912,7644079
Where good ideas come from | Steven Johnson,"http://www.ted.com People often credit their ideas to individual ""Eureka!"" moments. But Steven Johnson shows how history tells a different story. His fascinating ...",0af00UcTO-c,1238351,6550,179,350,TED,851185597,4912,7644079
What would happen if you didn't sleep? - Claudia Aguirre,"View full lesson: http://ed.ted.com/lessons/what-would-happen-if-you-didn-t-sleep-claudia-aguirre In the United States, it's estimated that 30 percent of adults ...",dqONk48l5vY,4251566,58682,660,6206,TED-Ed,691645424,227,4933236
"""TED CRUZ"" -- A Bad Lip Reading",It's time for a new kind of leader.... Like on Facebook! http://www.facebook.com/badlipreading Follow on Twitter! http://twitter.com/badlipreading.,v75wCTMZoSY,9426911,129287,2636,9886,Bad Lip Reading,860432713,5869,6285728
Surprising Lessons From 100 Days of Rejection: Jia Jiang at TEDxAustin,Chasing your dream requires you put everything out there and deal with the consequences. When aspiring entrepreneur Jia Jiang left corporate life to build his ...,ZFWyseydTkQ,458511,6166,78,267,TEDx Talks,1647594251,322,8471298
Two Monkeys Were Paid Unequally: Excerpt from Frans de Waal's TED Talk,"What happens when you pay two monkeys unequally? Watch what happens. An excerpt from the TED Talk: ""Frans de Waal: Moral behavior in animals."" Watch ...",meiU6TxysCg,12160563,42509,921,2352,TED Blog Video,18594290,5,17669
What makes a hero? - Matthew Winkler,View full lesson: http://ed.ted.com/lessons/what-makes-a-hero-matthew-winkler What trials unite not only Harry Potter or Frodo Baggins but many of literature's ...,Hhk4N9A0oCA,3383008,74651,522,3252,TED-Ed,691645424,227,4933236
What if 3D printing was 100x faster? | Joseph DeSimone,"What we think of as 3D printing, says Joseph DeSimone, is really just 2D printing over and over ... slowly. Onstage at TED2015, he unveils a bold new technique ...",ihR9SX7dgRo,779190,10186,140,933,TED,851185597,4912,7644079
What you don't know about marriage | Jenna McCarthy,"http://www.ted.com In this funny, casual talk from TEDx, writer Jenna McCarthy shares surprising research on how marriages (especially happy marriages) really ...",Y8u42OjH0ss,1681528,9748,4367,1567,TED,851185597,4912,7644079
"Mihaly Csikszentmihalyi: Flow, the secret to happiness","http://www.ted.com Mihaly Czikszentmihalyi asks, ""What makes a life worth living?"" Noting that money cannot make us happy, he looks to those who find ...",fXIeFJCqsPs,611453,3290,96,287,TED,851185597,4912,7644079
Thunder Buddy Song- Ted,"8 MILLION VIEWS!!!!! How amazing was Ted 2??? Look back at one of, if not the, greatest part of the first movie. The Thunder Buddy Song! The Thunder Buddy ...",G9PnNW56bp0,9768255,51981,1418,3920,David Dolgin,9769992,4,5558
The riddle of experience vs. memory | Daniel Kahneman,"http://www.ted.com Using examples from vacations to colonoscopies, Nobel laureate and founder of behavioral economics Daniel Kahneman reveals how our ...",XgRlrBl-7Yg,601659,5015,112,394,TED,851185597,4912,7644079
"Jane's Addiction- Ted, Just Admit It...","Off their studio debut ""Nothing's Shocking""",1CpRCc4Jre8,378496,2035,55,270,GrungeRiver,6430455,36,3498
Simon Sinek - Start With Why - TED Talk Short Edited,"Here's the link to the Original Version of this amazing, inspiring and thought provoking talk by Simon Sinek: Start with why - how great leaders inspire ...",IPYeCltXpxw,907346,2214,62,63,Chico Lima,907267,0,694
The best stats you've ever seen | Hans Rosling,"http://www.ted.com With the drama and urgency of a sportscaster, statistics guru Hans Rosling uses an amazing new presentation tool, Gapminder, to present ...",hVimVzgtD6w,2326255,15078,370,764,TED,851185597,4912,7644079
Clark - Ted,http://warp.net/records/clark The video for 'Ted' by 1stAveMachine. Visit throttleclark.com or 1stavemachine.com.,ymh13G8YgQE,894233,5240,65,465,Warp Records,62759804,572,124730
Ted Bear 2 - Cyanide & Happiness Shorts,Subscribe to Explosm! - http://bit.ly/13xgq7a Read Our Comics! - http://www.explosm.net/ Instagram: https://instagram.com/explosmofficial/ Twitter: ...,k0WbP2uLJPo,14129437,205979,2387,12871,ExplosmEntertainment,1846013490,923,7440513
Ted Says Relax,"Introducing Ted's brand new collection of luxurious loungewear: Ted Says Relax. Ultra-contemporary, whatever the altitude. Shop now: http://bit.ly/2fv4j88.",sOnWPr9wcz8,175,10,0,1,TED BAKER,16356209,2,10376
If I should have a daughter ... | Sarah Kay,"http://www.ted.com ""If I should have a daughter, instead of Mom, she's gonna call me Point B ... "" began spoken word poet Sarah Kay, in a talk that inspired two ...",0snNB1yS3IE,4762542,97983,1242,3356,TED,851185597,4912,7644079
"TEDxBloomington - Shawn Achor - ""The Happiness Advantage: Linking Positive Brains to Performance""","Shawn Achor is the winner of over a dozen distinguished teaching awards at Harvard University, where he delivered lectures on positive psychology in the most ...",GXy__kBVq1M,1314547,11195,148,323,TEDx Talks,1647594251,322,8471297
"SOULJOURNS - SOMETHING DIFFERENT, JODY CLEARY INTRODUCES TED HENRY","Nameste everyone! This is Jody Cleary here to tell you that due to many requests, I'm posting to Souljourns my husband Ted Henry's talk, given to the Sai Baba ...",P9izHq-Huto,662,31,0,5,Souljourns,2983299,51,9526
A guerilla gardener in South Central LA | Ron Finley,"Ron Finley plants vegetable gardens in South Central LA -- in abandoned lots, traffic medians, along the curbs. Why? For fun, for defiance, for beauty and to offer ...",EzZzZ_qpZ4w,742978,14672,96,1354,TED,851185597,4912,7644079
"Forget big change, start with a tiny habit: BJ Fogg at TEDxFremont","www.tedxfremont.com What if someone told you to floss only one tooth everyday? Or start the new year, not with grand resolutions, but with a simple challenge..",AdKUJxjn-R8,908131,8988,240,273,TEDx Talks,1647594251,322,8471298
What would happen if you didn't drink water? - Mia Nacamulli,"View full lesson: http://ed.ted.com/lessons/what-would-happen-if-you-didn-t-drink-water-mia-nacamulli Water is essentially everywhere in our world, and the ...",9iMGFqMmUFs,5100026,46703,988,5007,TED-Ed,691645424,227,4933236
Minecraft CHUCKYS TOY STORE!! - EVIL CHUCKY HAS TED CAPTURED IN HIS BASEMENT!! - Donut the Dog,Minecraft Roleplay Donut the Dog & The LittleClub Adventures SUBSCRIBE to REAL LIFE MINECRAFT HEROES: http://bit.ly/RealLifeYouTubeHeroes THE ...,0vmBFkpX96M,93701,658,33,63,Donut The Dog - Minecraft Adventures - Little Club,293839384,0,717530
"Beware online ""filter bubbles"" | Eli Pariser","http://www.ted.com As web companies strive to tailor their services (including news and search results) to our personal tastes, there's a dangerous unintended ...",B8ofWFx525s,973956,13210,174,885,TED,851185597,4912,7644079
Stunning Photos of the Endangered Everglades | Mac Stone | TED Talks,"For centuries, people have viewed swamps and wetlands as obstacles to avoid. But for photographer Mac Stone, who documents the stories of wildlife in ...",ApGeDdIaxo8,63063,1295,22,112,TED,851185597,4912,7644079
The year in ideas: TED Talks of 2014,"What were the most powerful ideas of 2014? Watch our 8-minute highlight reel of the Year in Ideas. Explore a fun, interactive playlist of the TED Talks of the year ...",7E9a24Nw6Cg,279200,5444,68,0,TED,851185597,4912,7644079
The game that can give you 10 extra years of life | Jane McGonigal,"http://www.ted.com When game designer Jane McGonigal found herself bedridden and suicidal following a severe concussion, she had a fascinating idea for ...",lfBpsV1Hwqs,810924,12840,436,1325,TED,851185597,4912,7644079
The transformative power of classical music | Benjamin Zander,"http://www.ted.com Benjamin Zander has two infectious passions: classical music, and helping us all realize our untapped love for it -- and by extension, our ...",r9LCwI5iErE,2544101,43508,453,1915,TED,851185597,4912,7644079
The Rise of Personal Robots | Cynthia Breazeal | TED Talks,"http://www.ted.com As a grad student, Cynthia Breazeal wondered why we were using robots on Mars, but not in our living rooms. The key, she realized: training ...",eAnHjuTQF3M,110343,999,76,301,TED,851185597,4912,7644079
New experiments in self-teaching | Sugata Mitra,http://www.ted.com Indian education scientist Sugata Mitra tackles one of the greatest problems of education -- the best teachers and schools don't exist where ...,dk60sYrU2RU,737656,8766,94,701,TED,851185597,4912,7644079
Flash Gordon in Ted (2012) - Full Scene,A homage to cheesy 80's film Flash Gordon in the 2012 fim Ted. Sam J. Jones turns up at Ted's party complete with Flash gordon theme song and slow motion ...,miU6ruUPZHI,1188988,3966,173,839,HLayton,1188035,0,340
How Meditation Can Reshape Our Brains: Sara Lazar at TEDxCambridge 2011,"Neuroscientist Sara Lazar's amazing brain scans show meditation can actually change the size of key regions of our brain, improving our memory and making ...",m8rRzTtP7Tc,947299,6976,156,446,TEDx Talks,1647594251,322,8471301
Sugata Mitra: Build a School in the Cloud,"Onstage at TED2013, Sugata Mitra makes his bold TED Prize wish: Help me design the School in the Cloud, a learning lab in India, where children can explore ...",y3jYVe1RGaU,410285,6750,87,593,TED,851185597,4912,7644079
Ai Weiwei detained. Here is his TED film,http://www.ted.com The news that Chinese artist Ai Weiwei has been detained by authorities has prompted significant concern here at TED-HQ. We had shown a ...,MVnH8ou3Kd4,216164,1907,38,461,TED,851185597,4912,7644079
Are we in control of our decisions? | Dan Ariely,"http://www.ted.com Behavioral economist Dan Ariely, the author of Predictably Irrational, uses classic visual illusions and his own counterintuitive (and ...",9X68dm92HVI,876329,8881,114,427,TED,851185597,4912,7644079
The left brain vs. right brain myth - Elizabeth Waters,View full lesson: https://ed.ted.com/lessons/the-left-brain-vs-right-brain-myth-elizabeth-waters The human brain is visibly split into a left and right side.,ZMSbDwpIyF4,358236,10313,223,602,TED-Ed,691645424,227,4933236
How to make healthy eating unbelievably easy | Luke Durward | TEDxYorkU,"After breaking his leg, undergraduate student Luke Durward used his time to return home and mentor his little brother on healthy eating. While illustrating his ...",Q4yUlJV31Rk,3150097,19944,4704,2275,TEDx Talks,1647594251,322,8471301
Ted Nugent - Stranglehold,Artist: Ted Nugent Song: Stranglehold Album: Ted Nugent Track: #1 Lyrics: Here I come again now baby Like a dog in heat Tell it's me by the clamor now baby I ...,0c3d7QgZr7g,16151851,74414,4060,10872,Amos Chetcuti,29730584,70,15556
"A kinder, gentler philosophy of success | Alain de Botton",http://www.ted.com Alain de Botton examines our ideas of success and failure -- and questions the assumptions underlying these two judgments. Is success ...,MtSE4rglxbY,931354,12031,185,613,TED,851185597,4912,7644079
Sylvia Earle: How to protect the oceans (TED Prize winner!),http://www.ted.com Legendary ocean researcher Sylvia Earle shares astonishing images of the ocean -- and shocking stats about its rapid decline -- as she ...,43DuLcBFxoY,186019,2016,21,245,TED,851185597,4912,7644079
The world needs all kinds of minds | Temple Grandin,"http://www.ted.com Autism activist Temple Grandin talks about how her mind works -- sharing her ability to ""think in pictures,"" which helps her solve problems that ...",fn_9f5x0f1Q,582979,5713,89,560,TED,851185597,4912,7644079
