title,description,videoId,viewCount,likeCount,dislikeCount,commentCount,channelTitle,CviewCount,CcommentCount,subscriberCount
Brene Brown at TEDxHouston,"Dr. Brene Brown is a researcher professor at the University of Houston, Graduate College of Social Work, where she has spent the past ten years studying a ...",X4Qm9cGRub0,1746741,12229,226,518,TEDx Talks,1647594251,322,8471302
"Hans Rosling: Global population growth, box by box",http://www.ted.com The world's population will grow to 9 billion over the next 50 years -- and only by raising the living standards of the poorest can we check ...,fTznEIZRkLg,784795,5545,205,1140,TED,851185597,4912,7644079
Addiction,"What causes addiction? Easy, right? Drugs cause addiction. But maybe it is not that simple. This video is adapted from Johann Hari's New York Times ...",ao8L-0nSYzg,13704964,332158,4451,19053,Kurzgesagt - In a Nutshell,269620619,23,4544245
Wireless data from every light bulb | Harald Haas,"http://www.ted.com What if every light bulb in the world could also transmit data? At TEDGlobal, Harald Haas demonstrates, for the first time, a device that could ...",NaoSp4NpkGg,716337,5070,86,690,TED,851185597,4912,7644080
Ted 2 - Official Trailer,"Newlywed couple Ted and Tami-Lynn want to have a baby, but in order to qualify to be a parent, Ted will have to prove he's a person in a court of law. Director: ...",i7wOFLLtTm8,1984929,17422,686,930,Machinima,5682156870,1212167,12605719
Buffy 2x11 - Buffy Hits Ted With A Frying Pan,"A scene from Buffy Season 2 Episode 11 (Ted) I DO NOT OWN THIS CREDIT GOES TOO... I do not own the copyrights contained in this video, I do not make ...",XE2ALidFqv4,2027,11,2,6,Laho Bo,46556661,632,22694
"I Hear You're A Racist Now, Father! - Father Ted","Father Ted tries to pass the time by impersonating a Chinese man using a lamp shade, he gets spotted and news spreads fast that he is a racist. 10 years ago ...",6zkL91LzCMc,2235404,21284,774,1879,Hat Trick,38213194,4,38844
"Why should you listen to Vivaldi's ""Four Seasons""? - Betsy Schwarm","View full lesson: http://ed.ted.com/lessons/why-should-you-listen-to-vivaldi-s-four-seasons-betsy-schwarm Light, bright, and cheerful, ""The Four Seasons"" by ...",Xcpc8VDsv3c,1391272,44940,369,1104,TED-Ed,691645424,227,4933236
Shah Rukh Khan's Speech At TED TALKS !!,"Friends, in this video I have talked to you about the BADSHAH of the Bollywood or the KING KHAN, Shah Rukh Khan. He has become the first Indian Actor to ...",qC9qUtEgwDw,872,26,0,14,SAM'S VLOG,14501,0,163
Bill & Ted's Excellent Adventure Official Trailer #1 - Keanu Reeves Movie (1989) HD,Subscribe to TRAILERS: http://bit.ly/sxaw6h Subscribe to COMING SOON: http://bit.ly/H2vZUn Subscribe to CLASSIC TRAILERS: http://bit.ly/1u43jDe Like us on ...,q3fx6TugN7g,573722,1946,56,247,Movieclips Trailer Vault,472714380,21,238697
Tom Da Lips - T.E.D.,Track available at Beatport: https://www.beatport.com/release/t-e-d/2085195 Traxsource: https://www.traxsource.com/title/846101/t-e-d.,IIo4n6M5lI0,66,3,0,0,NervousRecordsNYC,19329091,51,41082
What is Alzheimer's disease? - Ivan Seah Yu Jun,"View full lesson: http://ed.ted.com/lessons/what-is-alzheimer-s-disease-ivan-seah-yu-jun Alzheimer's disease is the most common cause of dementia, affecting ...",yJXTXN4xrI8,623414,6088,86,541,TED-Ed,691645424,227,4933236
Ted Mosby Speech,"This is the Ted Mosby speech to his future wife. Here is the transcript: ""Hi, I'm Ted Mosby and exactly 45 days from now you and I are gonna meet and we are ...",d9Q-rW433l0,917808,6935,48,1369,Irving Kcam,917372,0,113
How to start a movement | Derek Sivers,"http://www.ted.com With help from some surprising footage, Derek Sivers explains how movements really get started. (Hint: it takes two.) TEDTalks is a daily ...",V74AxCqOTvg,849929,5087,116,333,TED,851185597,4912,7644080
Why videos go viral | Kevin Allocca,"http://www.ted.com Kevin Allocca is YouTube's trends manager, and he has deep thoughts about silly web video. In this talk from TEDYouth, he shares the 4 ...",BpxVIwCbBK0,500435,5034,202,392,TED,851185597,4912,7644080
Grammar's great divide: The Oxford comma - TED-Ed,"View full lesson: http://ed.ted.com/lessons/grammar-s-great-divide-the-oxford-comma-ted-ed If you read ""Bob, a DJ and a clown"" on a guest list, are three people ...",ptM7FzyjtRk,885102,9410,199,765,TED-Ed,691645424,227,4933236
Karen Armstrong: 2008 TED Prize wish: Charter for Compassion,"http://www.ted.com As she accepts her 2008 TED Prize, author and scholar Karen Armstrong talks about how the Abrahamic religions -- Islam, Judaism, ...",SJMm4RAwVLo,150765,991,107,403,TED,851185597,4912,7644080
"Jake Shimabukuro - ""Bohemian Rhapsody"" - TED (2010) - ukelele cover","Jake Shimabukuro strums monster sounds out of the tiny Hawaiian ukelele, as he plays a cover of Queen's ""Bohemian Rhapsody."" A sensational performance ...",PB3RbO7updc,8513110,68920,1107,3734,Hamza Tazi,8518654,2,7118
My Lovely Horse | Father Ted,Watch Father Ted on All 4: http://www.channel4.com/programmes/father-ted.,jzYzVMcgWhg,2072402,10335,198,1556,Channel 4,427079409,1546,390834
Introducing TED-Ed: Lessons Worth Sharing,TED-Ed's mission is to capture and amplify the voices of great educators around the world. We do this by pairing extraordinary educators with talented animators ...,FfJ5XG5i2aw,398955,2078,19,99,TED-Ed,691645424,227,4933236
Ted Bear - Cyanide & Happiness Shorts,Subscribe to Explosm! - http://bit.ly/13xgq7a Read Our Comics! - http://www.explosm.net/comics/ Facebook: https://www.facebook.com/explosm Twitter: ...,zDCNJdeM9PE,14811371,128341,2596,9951,ExplosmEntertainment,1846013490,923,7440512
"""Ted Haggard Is Completely Heterosexual"" by Roy Zimmerman","http://www.royzimmerman.com/ Please subscribe to my Channel My songs are available through my website and on iTunes. Here, I perform ""Ted Haggard.",HZmHC75FDqQ,530249,8492,176,1272,RoyZimmerman,7682975,824,20930
"Ted Leo & The Pharmacists - ""Bottled In Cork"" (OFFICIAL VIDEO)","The second video from TL&Rx' new album ""The Brutalist Bricks"". Purchase ""The Brutalist Bricks"": http://bit.ly/aACVku Directed by Tom Scharpling Full credits: ...",w248uwpAX14,191320,1060,37,123,Matador Records,47919984,111,51705
Bill and Ted's Bogus Journey Trailer (1991),"The sequel to ""Excellent Adventure"" and as wildly funny and most triumphant! An interesting follow up to the original however it's appearance is different from the ...",aIeFo9zzdVg,393099,930,34,251,glows,38968732,86,7147
Dave Eggers: 2008 TED Prize wish: Once Upon a School,"http://www.ted.com Accepting his 2008 TED Prize, author Dave Eggers asks the TED community to personally, creatively engage with local public schools.",FaSF1gPBKrA,62906,326,7,21,TED,851185597,4912,7644081
Father Ted | On Holiday,"In this classic clip Father Ted, Dougal and Jack take their annual holiday in the caravan. Subscribe for more: http://bit.ly/hattricksub Life is hard for Father Ted.",GFTgkibl7DU,437193,1158,41,58,Hat Trick,38213194,4,38844
Ted's Birthday,30 people throw a birthday party for a random stranger in a bar. More info: http://improveverywhere.com/2010/02/28/teds-birthday-2/ 30 people throw a birthday ...,0EjuEx95u3Y,1451591,13861,223,1844,Improv Everywhere,430355442,387,1850774
"'Golden Voice' homeless man finds job, home after viral video success","Ted Williams, a homeless US man with a deep, refined voice has become an overnight online sensation after being ""discovered"" by a local reporter on a street ...",6rPFvLUWkzs,40295571,147024,3468,24437,RT,2077937601,3,2171679
Bill & Ted's Excellent Adventure HD Trailer,"Two airheads, who are about to fail history class, are given the chance to take an epic trip through time. Keanu Reeves and Alex Winter star in the most ...",sFy17auuK08,527369,1637,59,0,wormontheweb,1246183,1,344
Ted's & Marshal's - 500 miles ( HIMYM - fun time ),"Ted and Marshall on a crazy trip. 3x best cuts of S05E05 episode of HIMYM. Ted's ""thank you"" and more. Song: Proclaimers - 500 miles all rights reserved to ...",yhcFpbnQghk,1323596,7383,60,366,naviliss,1347994,0,128
Scrubs - Ted's Band Compilation,A complilation of clips of Ted's Band from Scrubs. Some of the newer ones are missing. They're called The Blanks in real life and can be found on ...,yMo_boi1Yw0,1903882,10331,153,1449,Michael Walsh,1904786,36,202
Ted Bundy's Last Interview,http://XXXCHURCH.com Serial Killer Ted Bundy shares his last interview before being executed.,Vlk_sRU49TI,3004478,10207,2838,0,triplexchurch,6119779,16,7274
TED NUGENT- WANGO TANGO,TED NUGENT- WANGO TANGO MY FAVORITE SONG FROM HIM.,LqFUEcM9wR0,1697357,6254,490,988,johndangerous13,1970502,28,1731
An argument for game artistry | Kellee Santiago | TEDxUSC,Are Video Games Art? Game innovator Kellee Santiago insists that games are more than entertainment. As a student in the MFA Interactive Media program at ...,K9y6MYDSAww,122011,580,60,278,TEDx Talks,1647594251,322,8471301
Former FBI Chief Ted Gunderson Says Chemtrail Death Dumps Must Be Stopped,"Former FBI Chief, Ted L. Gunderson, makes a statement regarding the chemtrail ""death dumps"", otherwise know as air crap, on January 12, 2011. Ted says the ...",gR6KVYJ73AU,446164,4128,194,2555,aircraporg,648541,67,1631
Ted Nugent - Great White Buffalo (1987),1987 live (last video from this concert I have Ted Needs to put this out on dvd !),VMZwS0ZonEU,1830126,7096,347,0,page14617,2164864,9,1306
An American Coach in London: NBC Sports Premier League Film featuring Jason Sudeikis,Check out the Return of Coach Lasso here: http://youtu.be/iRqypM7jb5Y Coach Lasso (Jason Sudeikis) has just arrived in England to coach Tottenham Hotspur ...,6KeG_i8CWE8,10844090,64804,896,5808,NBCSportsNetwork,17653649,33,13918
The great porn experiment | Gary Wilson | TEDxGlasgow,"Never miss a talk! SUBSCRIBE to the TEDx channel: http://bit.ly/1FAg8hB In response to Philip Zimbardo's ""The Demise of Guys?"" TED talk, Gary Wilson asks ...",wSF82AwSDiU,8848823,64186,3246,0,TEDx Talks,1647594251,322,8471302
Making sex normal | Debby Herbenick | TEDxBloomington,The belief that human beings -- throughout their lives -- deserve to have access to accurate information about their bodies and sexuality drives much of Debby ...,CE3tL9MMk3U,2375859,9097,1334,2094,TEDx Talks,1647594251,322,8471302
Ellen Page confronts Ted Cruz over LGBT rights,"The Canadian actress, who came out as gay last year at a pro-LGBT conference organized by the Human Rights Campaign, got into a heated back-and-forth ...",Iu1lsw3_Kfo,472505,3755,544,7052,CBS News,421183283,3855,408093
Ted,Joselin.,YBC7m1qP24A,0,0,0,0,Joselin Macias,0,0,0
Ted 2 / Trailer sin censura (Solo adultos),"Ted 2 estrena en Mexico el verano del 2015. En esta nueva aventura Ted se casa y esta decidido a tener un hijo, solo que hay un pequeno problema ?Quien ...",jF3IV3IHQoY,15469505,32459,4639,1108,universalpicturesmx,446790885,496,620047
"Make love, not porn (Adult content) | Cindy Gallop","At TED2009, audience member Cindy Gallop gave a 4-minute presentation that became one of the event's most talked about. Speaking from her personal ...",FV8n_E_6Tpc,2046524,7806,747,1992,TED,851185597,4912,7644081
TED gets mad because johnny's totally losing it,Ted comedy.,_FfzW-XUMmA,1,0,0,0,Masha Kranium77,0,0,0
Charlas TED Ed - Delfina Zaroli,,24hJ6Xw2Ik4,0,0,0,0,LaColomboTV,3547,0,55
TED TALK On book 1984,,zjVXdeH3lpk,2,0,0,0,evelyn ochoa,0,0,0
Charlas TED Ed - Delfina Nole,,q2WK0X6eKB4,0,0,0,0,LaColomboTV,3547,0,55
Synthepher | T.E.D. Island,First fanmade monster (for T.E.D. Island) yee Sorry for the cruddy image quality. ELEMENT(S): Earth/Shadow BIO: I'll add it another time lol PLAYS: Toe ...,f3yJOAkRNvw,6,0,0,5,Soggy Yelmuts,1319,0,12
Ted video and Jackpaul,1000k.,HwiOpX7v67I,0,0,0,0,Vernon Sharrock,59,0,0
Muaway- X1 VLD  -iSOONIC vs -Ted    - TESTE 1,ENTAO MEU 1 VIDEO E PRIMEIRA VEZ QUE EDITO UM VIDEO POR ISSO FICOU DESSA FORMA FOI TUDO MUITO RAPIDO MAIS TAMOS AE : SALVE PRA ...,OscLy9fY8B4,17,10,0,3,Player Sonic,0,0,0
Ted 2 - Official Restricted Trailer (HD),"Ted 2 - Official Restricted Trailer (HD) Ted Is Coming, Again - June 26 http://www.legalizeted.com/ #LegalizeTed Seth MacFarlane returns as writer, director and ...",8eHufVyP2gE,2417778,17236,858,1344,Universal Pictures,849031624,830,1042457
